Movie name,Review,Created at,Score,Genre
Independence Day: Resurgence,"As was proven with Core, there actually is a way to do these event/disaster/nuclear bombs are good movies the right way. Such movies need to be so over the top, so ridiculous, so free of any political statements and so cleverly scripted that you forget that you're supposed to loathe stupidity and instead accept the nonsense as somehow natural. Independence Day: Resurgence does some of this but nowhere near enough. It manages to get serious and sentimental at the most laughable of times while completely missing any opportunities to insert some much needed comic relief. It also repeats the cardinal mistake made in the first one by having the president of the present world empire and his nuclear weapons save humanity. If the Germans had won the war, Independence Day: Resurgence would have featured **** flying fighter planes against the evil aliens. But they didn't so the US president gets the job. Good movies need to find a way to save the world that does not include the Pentagon or corrupt politicians and other control freaks. There has never been a heroic US president. Never. So why do we have to have one in Independence Day? It's like having an honest lawyer or economist in a movie. No one would watch it because it's not realistic. Heroic US presidents are even less realistic, yet somehow we're supposed to accept it in movies. And obviously the heroic president loves him some world empire, just like Wall Street and the other fatcats who are screwing us over. What a coincidence that the imaginary heroic president wants to rule the world, exactly like his non-heroic real world counterparts! The propaganda just never ends here. Accept US world empire or you're with the aliens(terrorists/communists/insert next bogus scare here)! So when you go balls to the wall with this low grade US militarism propaganda all chance of a light approach go out the window. You either love the empire and cheer for the humans or you hate it and are forced to cheer for the aliens. You know they're losing anyway, so no matter how big their boat is they are the eternal and doomed underdogs in Hollywood movies. So, definitely a big thumbs up for all the people who take US war propaganda seriously and people who tear up when nuclear bombs, unbelievable stupidity and horn music save the world once again. A rather big thumbs down if you don't respond well or at all to these things. Other than the embarrassingly obvious propaganda in Independence Day: Resurgence, the only other reason to watch it might be the visuals. But how many different tidal waves can Hollywood make where the eastern seaboard of the United States gets destroyed before people lose interest? In another case of blatantly obvious and slimy imperialist propaganda, the tidal wave in this awful movie manages to stop just outside the west wall of the White House; or as I prefer to call it: the Pig House. Oh and the acting is atrocious as well, and so is the writing. If you don't like Jeff Goldblum this will do nothing for you. Unfortunately I find him to be about as convincing an actor as Steven Segal, so for me he actually manages to drag something that belongs in a toilet already through all the sewage pipes and off to sea whenever he is in a movie. Watch if you want to be a Good German, uh, I mean Good American. Take it outside, douse it with gasoline and set fire to it if you don't.","JAN 13, 2017",1,Adventure
Independence Day: Resurgence,"I don't know what this is. Winking self-parody? Sure, absolutely. The first one to 11? Sure, if more CGI and bigger stuff and more nonsense is 11. How about less chemistry between actors, less good Goldblum (a near impossibility) oh and a f***ing giant spider as the final boss! Err, I mean, main villain that's a many legged queen alien that just happens to resemble a spider because the imagination can be a desolate place sometimes. Emmerich doesn't get the master of disaster respect he kind of deserves, and this is why (also some of his other movies, whatever, I do have a point). People are saying Will Smith dodged a bullet by starring in Suicide Squad (and sure, Collateral Beauty too) instead of this. That's like saying he dodged a bullet by maiming himself. It's a better outcome but no less painful and also what was the point of it all?","JAN 5, 2017",3,Adventure
Independence Day: Resurgence,"Same plot, more VFX, less fun. The pace of the film is poorly measured, urgency and tension are absent, and humor is tasteless. The scenario is a bad copy of the first film, and shines by outbidding inconsistencies. I recently reviewed the original, and it already struggled to make me laugh as much as I remember. This following has simply failed to make me smile, and I hope not to remember it... In short: a waste of time and money.","OCT 12, 2016",2,Adventure
Independence Day: Resurgence,"Pure disgusting, filthy, trivial, ridiculous, junk & trash. Grotesque, not deliberately, not funny, stupid. Take only audio-track and make it play on a Dolby system, the rest is really ****.","OCT 22, 2016",1,Adventure
Independence Day: Resurgence,"I've seen some bad **** movies in my live, some that didn't even try to stand above the ""b-movie"" standard. But this one godammm tops it all, no a single line, not a single frame of this movie is decent.... probably the worst piece of junk Ive managed to watch for more than 30 minutes","SEP 26, 2016",0,Adventure
Mulan,"I don’t know why the negative comments, this movie is better than animated version, in my opinion a masterpiece with many excellent actors!","MAY 22, 2021",10,Adventure
Mulan,GOODGOODGOODGOODGOODGOODGOODGOODGOODGOODGOODGOODGOODGOODGOODGOODGOODGOODGOODGOOD,"SEP 17, 2021",10,Adventure
Mulan,"A poetic journey of epic & emotional proportions, fueled with a profound and pure humanity, and with a subtext that is gonna resonate with numerous people all over the world ... First, the photography and all the visual language that accompanies you from beginning to end, are a true delight for the eyes ... A majestic fresco, with a color treatment that highlights each & every shot. Yes, the photography is really striking and can't leave you insensible. Also, the music inhabitates every chapter with an immense grace, and accompanies this emotional journey alongside Mulan in the most grandiose way ! The screenplay keeps the same main beats as the original animated version, but upgrades the storyline as a whole, with more subtlety and depth ... Yifei Liu has a magnetic presence and transmits us a lot of emotions through her so expressive eyes ... Of course, the choregraphies and the staging also have a very finely artistic language, which flows like a smooth dance, throughout the movie ... Obviously there are some striking scenes and images that nicely punctuate the adventure and participate to make it evolve into an ever more epic & emotional way. Mulan's interactions with each character, are a big strenght of the movie, they all are a step and a deciding element in her evolution as a woman & hero, from the very first scene up until the very last scene. A beautiful movie, on many levels.","SEP 12, 2020",8,Adventure
Mulan,"LOVED EVERY MINUTE OF IT!! I loved the updated storyline, the all Asian cast, the kinship amongst the female antagonist and female protagonist. I watched it with my boys and they enjoyed it as well. Disney did a wwwaaayyyyy better job with this remake than they did with the Lion King. I was entertained and super enthralled in the story. Will definitely watch it again and again.","FEB 13, 2021",10,Adventure
Mulan,"Leaving aside the fact that this movie Is different to the original of 1998; the script, cinematography and the production is very big in quality.","DEC 13, 2021",7,Adventure
Mulan,"It didn't (maybe couldn't?) live up to the hype, but it was enjoyable enough.","SEP 19, 2020",7,Adventure
Mulan,"Cuties may be the best movie of 2020. But Mulan's live action remake is totally a close second, and both are underrated gems that deserve more attention than they get. This movie is an absolute IMPROVEMENT over the original nightmare of a ""film"" in every way possible. It removes some horrific dumpster fires of characters like sHAnG and MuShU and the godawful CrICkET. But aside from that, it replaces them with meaningful, well written new characters like the Phoniex Witch that can turn into a bunch of birds. It also introduces a Chi, an awesome sword that is very useful and welcoming in battle, and it makes Mulan into an actual CHARACTER rather than a lazy stupidly clumsy PRINCESS like the original film's version of her that's helplessly waiting for her prince. Please pay the price to view this amazing film! It should be taught in film school, let's be real and very honest.","OCT 21, 2021",10,Adventure
Mulan,"it is a great movie, lotsa beauty scene, costume all great and love Yifei since 2005 !!","SEP 12, 2020",10,Adventure
Mulan,I am a simple girl from a very simple place. I lost my father too young. This movie made me cry six different times. It made me feel like I could conquer the world. It made me feel like I can be respected in the real world. It made me feel like I can be proud to be a girl. and where I'm from that's just not possible for girls. I hate that people keep comparing this film to the brilliant 1998 original film. This film is different. This film feels different. because this film feels real and honest and true to me. I thank every one who brought this film to life. even if it made my life better for just 2 hours I can live off those 2 hours for weeks to come.,"SEP 13, 2020",10,Adventure
Mulan,"It was an okay film I guess. Really not kuch to say about it, probably as balnd as one can get and considering the controversy around it and the hegty $30 price tag I would urge one to skip this film.","SEP 18, 2020",8,Adventure
Mulan,"Since I haven't seen the original animated movie, this was a completely new experience for me. It was a fun movie that couldn't amaze in terms of story. Still, it was fun enough to live with the characters. Sometimes it was superficial but the atmosphere in it’s world and scenes was very good.","DEC 29, 2020",7,Adventure
Mulan,"Amazing movie!!! Beautiful story Beautiful scenery. Vibrant colors. Worthy characters tugging at our heartstrings. The Chinese speaks English surprisingly well. Liu Yifei is 33, but still looks like a pretty teen. She did well, but isn't really suitable for the role as she's too dainty, soft-spoken and unable to reach the lofty heights of a true pugilist. Love her spinning spear kick though! Great CGI. Powers and skills are too fantasy-like for movie to have a realistic feel. LOL A pity I watched this great movie on my tiny budget 27 inch monitor. ;p","NOV 14, 2020",10,Adventure
Mulan,"OBRAAAAAAA PRIMAAAAAAAAAAAA, AGUILERA QUEEN... whoever didn't like it cuts themselves or sticks their finger in their c# and smells it.","JAN 1, 2021",10,Adventure
Mulan,"It has big differences from the animation, but it is still one of the best live-actions.","OCT 7, 2023",10,Adventure
Mulan,"A new Disney remake of one of the most famous cartoons, released in 1998, Mulan can claim the title of one of the best Disney remakes, I want to say right away that all the scandals that enveloped this remake should not affecton the perception of the film.this movie is made with a lot of potential, it also shows a new story with some skeleton, which is a big jerk because this is one of the remakes that does not copy the original plot, new characters have been added that fit quite well intohistory. the graphics are made at a high enough level, the acting has a good color, each character is sufficiently disclosed and has its own story, of course, there are some drawbacks, but there is not a single film that would be without drawbacks. In the end, I want to say that this film will grow in the eyes of people who like to think, and not just watch; also, this film will give an impetus to many to develop and achieve their goals, despite the opinion of society.","SEP 19, 2020",10,Adventure
Mulan,"This film takes away all the good things from the disney original and isn't fun at all. It's inaccurate even though the film's advertising promised to be culturally accurate! It's controversial because it films in a concentration camp in China, and that's a very valid critique. It has too high score on the rotten tomato's. Don't go pay to see it it's not worth your time, go watch the disney animated mulan it's a lot better and it;s one of my favorite disney films.","DEC 17, 2020",10,Adventure
Mulan,"Wonderful! The whole movie looks like a paint, beautiful scenery, full of colors!","DEC 12, 2020",10,Adventure
Mulan,"If you are judging in the ""TRUTH"" logic, you must give only 6 - 7.5, but if according to the fantasy principle, take it 10 out of 10","SEP 18, 2020",10,Adventure
Mulan,"I know it has brought up controversy, but try to move past that, watch it as a stand alone movie with some reference to the original. Most people giving it a 0 haven't even watched it. Give it a chance, I personally loved it. And the acting in the movie is actually pretty good.","NOV 4, 2020",8,Adventure
Mulan,"Me and my girlfriend both loved it! It was an experience. The photo, the actors, the script, the soundtrack. Well balanced and straight-forward. Simply beautiful. I will watch this movie many times more...","DEC 5, 2020",10,Adventure
Mulan,Amazing movie,"SEP 10, 2020",10,Adventure
Mulan,Absolutely loved it! Great that they didn't sing. Haha. That ruins live action retellings because it never works the way it did in the cartoons. Well made and the action was superb!,"DEC 17, 2020",10,Adventure
Mulan,"I don't understand the hate on this movie by audiences, which I thought was a great deal better than live action 'Aladdin' (almost no chemistry between characters) and photo-realistic 'Lion King' (no emotion). This one had some neat choreography in it and *shock* some actual acting (although to be fair to 'Aladdin', at least Jasmine and Genie Will Smith were decent).","JUL 14, 2021",7,Adventure
Mulan,Decent for what it us. I felt it would have been better shot in Cantonese or Mandarin with english subtitles,"SEP 27, 2020",7,Adventure
Mulan,"Despite bringing interesting action scenes, with very nice special effects, perhaps 'Mulan' is not one of Disney's great triumphs. With strange cuts and a sequence of somewhat random scenes, the film falls short in aspects of oriental culture and also in the plot.","DEC 5, 2020",7,Adventure
Mulan,"As an American, this is the most accurate movie showing China history. The fight scene is one of the best in 2020. This movie shows that any woman can be as good as man. It's better than the Chinese made Mulan 2009 movie, which is visually plain with boring fights.","OCT 12, 2020",10,Adventure
Mulan,"I think most of the good reviews are from women. I loved Mulan growing up and this film gave me goosebumps several times. Yes, it's not exactly as the animated film, I would've preferred a dragon than a Phoenix but I love the artistry and visuals of this film! It feels more like a ""Crouching tiger, hidden dragon"" type film than Disney.","NOV 29, 2020",8,Adventure
Mulan,I rate this movie 20 on 10 for the courage the movie protagonist shows. Don't bother about the one rating by most of the Chinese who would only care about expansionism and attack all their neighbours. India won't take it lying down and now neither will the world.,"DEC 6, 2020",10,Adventure
Mulan,"While this will never compare to the 1998 original animated Disney **** 2020 live-action version of Mulan is a good movie for a clean, family-friendly action movie night. It can seem dull and soulless at times, lacking the humor and good-natured fun of the original, but is easily one of the better live-action remakes from Disney.","FEB 9, 2021",7,Adventure
Mulan,"E-Value: 7 Acting: 8 Plot: 6 Mulan is the latest Disney live-action remake of their 1998 movie of the same name. Due to the COVID-19 pandemic which forced theatres to shut down, The Walt Disney Company have decided to release Mulan via Disney+ for a premium fee while other countries will have theatrical release where the local theatres have been slowly reopened. Set in Imperial China, Hua Mulan (Yifei) is an adventurous and active girl much to her parents’ disappointment who had hope to find her a good husband. Somewhere in the Imperial outpost to the north, Rouran warriors led by Bori Khan (Lee) attack the outpost with the help of a powerful and shapeshifter witch named Xian Niang (played by Gong Li). Because of the attack, the Emperor of China (played by Jet Li) decree that every family in the country must contribute one man to fight against the invaders. Unfortunately for the Hua family, Mulan does not have any brothers which means her father, who is a former soldier in the Imperial Army, must contribute himself to fight in the war. Due to her father’s ailing health and may not survive the war, Mulan decide to take her father’s place as soldier and sneak out of her home at night along with her father’s sword and armour. Disguising herself as a man and called herself Hua Jun, she joins the Imperial Army under the command of Commander Tung (Yen) where she trains with the other conscripts to prepare for the upcoming war without exposing herself as a woman. Unlike last year’s Aladdin and The Lion King live-action remakes, Mulan is not a full adaptation of its animated movie as there are some changes in this movie. Despite the changes, the basic plot of the movie still remains the same as its original counterpart and easy to follow. While Mushu does not appear in this movie and no singing songs moments, it really does make sense for not to be in this movie is because it would have been unrealistic given the direction of this movie. For the performance of the cast, everyone has done a great job especially Liu Yifei and Donnie Yen. However, some of the characters didn’t really have much character development which made them easily forgettable later on. As for Gong Li’s character, I felt her character wasn’t really developed well and her character’s purpose was only to serve as the evil counterpart to Mulan. While this movie cannot be compared to 2009’s Mulan: Rise of a Warrior, which is a Chinese production and with more realistic and darker tone, this movie is still watchable on its own and it is meant for family and children. Same goes to the original animated movie. Whichever one is better is up for a debate. If you have seen the original animated movie and the 2009 movie, give this movie a shot.","OCT 23, 2020",7,Adventure
Mulan,"The movie it's not epical, as he selled himself, he's not great, has not nostalgic appeal, it's just a good movie. Nothing more then that","SEP 4, 2020",6,Adventure
Mulan,"Saw 2020's 'Mulan' as a massive Disney fan. Although their recent live action offerings are very mixed and none are as good as the originals, many of their animated films are fine examples of how to do animation right. Looking at the title, the advertising and that seeing it was made by Disney, it is very easy to think that this is another one of the live action remakes and it is easy why it has been critiqued as one. Part of me was really psyched being somebody who loves the 1998 film, but also worried when seeing the hate for the film and for the lead actress. When seeing 'Mulan', it didn't actually strike me as a live action remake and doesn't have an awful lot of Disney in sight. Other than the title and references to the score of the 1998 film embedded in this one. Instead to me it came over as more another version of the character and her story, and one more serious and less family friendly, so directly comparing the two films didn't strike me as right. While the disappointment that is expressed is understandable, as there are big flaws to be found and it definitely does not have the same amount of charm, heart and thrills as the 1998 film, to me 'Mulan' was not that bad and was not deserving of the extreme backlash before it was even released. Seeing as Yifei Liu's personal views had/have nothing to do with Disney or the film crew. 'Mulan' is not perfect. Do agree with those that say that a lot of the dialogue is pretty bad, with a tendency to sound stilted, especially in the cringe-worthy and very out of place attempts at sporadic humour with the troops, and go too heavy on emphasising the characters' values. Loyal, brave and true agreed did not need to be emphasised so much, the point was made quite quickly. There are things in the plot that sounded oddly intriguing on paper, but done too little with. Especially with the phoenix, which doesn't really add anything. Both Xianniang and Bori Khan felt like underdeveloped characters. The former comes off better as she is suitably mysterious and alluring, but her motives are pretty confused later on (with it being not clear what side she was on), she is pretty much a come and go plot device and her final scene felt very rushed. Bori Khan has an intimidating look but is underused and his motivation is pretty much the only thing that is learnt about him. Didn't like how easily defeated he was and how clumsy the scene looked. In general the characters could have done with more depth, Mulan and Zhou are the ones that come closest, and the film could have done with more soul. However, 'Mulan' does look great, especially striking in the truly exquisite historical visuals and the at its best majestic scenery. There is a lot of colour and atmosphere in the photography, which was clearly inspired by the likes of Zhang Yimou, and the costumes do catch the eye. The CGI didn't seem too excessive and didn't look jarringly cheap either. Harry Gregson-Williams' score is stirring and also has a sumptuous emotional core, also enjoyed hearing references to the music from the 1998 film. Niki Caro on the most part directs with confidence. Personally really was impressed by the beautifully choreographed and dynamically photographed action. When it needed to be tense it was, when it needed to be particularly athletic it was and when it needed to excite it did. Especially the big battle and the avalanche. It was easy to feel the strength, pain and perseverance needed to get through all that training, only the final showdown came over as ridiculous. The story was not perfect but it engaged enough, intrigued with the cultural aspects and inspired thanks to Mulan still being a strong character (though she doesn't grow as much or go on a character journey as much as the animated Mulan, if to briefly compare). Although the father-daughter reunion was more emotionally powerful previously, it is still quite moving in a subtle way here. Moreover, the acting wasn't bad at all to me. Liu is a confident lead, bringing authority and vulnerability to Mulan that was ideal for this ideal heroine. Donnie Yen and Jet Li are strong authority figures and Jason Scott Lee does inject some menace into his underdeveloped role. Tzi Ma's performance is very telling in its nuance, more than once not even saying a word. Li Gong looks wonderful in the film and is both deceptively alluring and mysterious, despite the character herself is not meaty Gong's acting is quite complex. In conclusion, prepared myself to hate it but quite liked it while finding it very flawed. 6/10","MAR 22, 2022",6,Adventure
Mulan,"Generic Disney slot machine. Much inferior to the original animation. It is also necessary to point out the rushed development of the story, the lack of charisma of the supporting characters and, of course, the boringness and cliché that the phoenix means. If there is anything to be saved, the (shallow) discussion about women, their social, feminist role and, of course, sisterhood prevents the film from hitting rock bottom.","DEC 27, 2020",4,Adventure
Mulan,It was very inspiring movie I even watched l liked it very much and the story and the background score was 超,"SEP 9, 2020",5,Adventure
Mulan,"Key scenes are missing that remove much of the drama and importance in a film that somehow takes longer to tell less of the story than the animated version. Despite this it is watchable, mainly for the cast who I won't fault and the score. Where this film fails is entirely on the writing, directing and that damn CG phoenix that looks like a kite.","SEP 6, 2020",6,Adventure
Mulan,"It's a very bland movie, I guess it would be passable if it was a budget movie, but it's a hugely expensive production, they actually wasted more than $200 million on making this junk.","SEP 6, 2020",5,Adventure
Mulan,"Kinda boring and poorly paced. Cutting 20 minutes would really help. Not a particularly fun movie. Pretty vistas. I disliked giving the hero Ki powers. The whole point of the story is a normal girl worked hard, was brave and clever, etc. Instead now she’s a superhero? Weird choice that undermines the character, plot and theme of the whole narrative. The original is far more enjoyable.","SEP 5, 2020",4,Adventure
